title,type,url
"Timely food market information is key amid crises, agriculture group says",News item,https://www.wto.org/english/news_e/news23_e/agri_07nov23_e.htm
Working group on food security moves closer to finalizing report and recommendations,News item,https://www.wto.org/english/news_e/news23_e/agri_31oct23_e.htm
"WTO members review farm policies, discuss food security, agri-food system resilience",News item,https://www.wto.org/english/news_e/news23_e/agri_28sep23_e.htm
"Working group on food security reviews coordinator’s report, discusses way forward",News item,https://www.wto.org/english/news_e/news23_e/wpfs_21sep23_e.htm
"DDG Paugam: Trade can help us respond to food security, sustainable development challenges",News item,https://www.wto.org/english/news_e/news23_e/ddgjp_04sep23_e.htm
DG Okonjo-Iweala underlines role of trade in transforming food systems at UN summit,News item,https://www.wto.org/english/news_e/news23_e/dgno_26jul23_e.htm
Food security work programme enters decisive phase,News item,https://www.wto.org/english/news_e/news23_e/wpfs_19jul23_e.htm
DDG Paugam: Cooperation and agricultural reform are needed to tackle food security crisis,News item,https://www.wto.org/english/news_e/news23_e/ddgjp_12jun23_e.htm
"Working group on food security intensifies discussions, eyes first report in July",News item,https://www.wto.org/english/news_e/news23_e/wpfs_08jun23_e.htm
Global imports of seaborne wheat maintain upward trend,Blog,https://www.wto.org/english/blogs_e/data_blog_e/blog_dta_08jun23_e.htm
DG Okonjo-Iweala: Trade key to ensuring food security in a time of crisis,News item,https://www.wto.org/english/news_e/news23_e/ddgno_01jun23_e.htm
New Global Trade Data Portal offers real-time access to trade data,News item,https://www.wto.org/english/news_e/news23_e/rese_31may23_e.htm
DDG Paugam explores closer WTO-IICA cooperation on agriculture and food security,News item,https://www.wto.org/english/news_e/news23_e/ddgjp_05may23_e.htm
"Progress in agriculture talks in “immediate future” is crucial, chair tells negotiators",News item,https://www.wto.org/english/news_e/news23_e/agng_04may23_e.htm
DDG Paugam: Trade is essential in responding to food security crisis,News item,https://www.wto.org/english/news_e/news23_e/ddgjp_20apr23_e.htm
"Working group on food security discusses building resilience, financing challenges",News item,https://www.wto.org/english/news_e/news23_e/fsec_12apr23_e.htm
New report calls for G20 coordination to address causes of food insecurity,News item,https://www.wto.org/english/news_e/news23_e/agri_13apr23_e.htm
DG stresses urgent need for progress on trade and food security ahead of MC13,News item,https://www.wto.org/english/news_e/news23_e/agri_31mar23_e.htm
"Members maintain focus on food security, discuss farm policies, transparency",News item,https://www.wto.org/english/news_e/news23_e/agri_28mar23_e.htm
Food security: The key to unlocking agriculture negotiations at the WTO?,Blog,https://www.wto.org/english/blogs_e/ddg_jean_marie_paugam_e/blog_jp_28mar23_e.htm
"New working group on food security discusses financing challenges, questionnaire results",News item,https://www.wto.org/english/news_e/news23_e/wpfs_01mar23_e.htm
"Farm talks restart with positive momentum, focus on food security",News item,https://www.wto.org/english/news_e/news23_e/agng_27feb23_e.htm
"DDG Ellard discusses benefits of multilateralism, risks of unilateralism, WTO reform",News item,https://www.wto.org/english/news_e/news23_e/ddgae_13feb23_e.htm
Agency heads call for urgent action to address food and nutrition security crisis,News item,https://www.wto.org/english/news_e/news23_e/fsec_09feb23_e.htm
DDG Paugam: Trade is crucial to ensure sustainable food supplies in times of crisis,News item,https://www.wto.org/english/news_e/news23_e/ddgjp_21jan23_e.htm
DDG González: Multilateral trading system must do more to avert food security crisis,News item,https://www.wto.org/english/news_e/news22_e/ddgag_08dec22_e.htm
Agriculture Committee’s new working group on food security launches a needs questionnaire,News item,https://www.wto.org/english/news_e/news22_e/agri_07dec22_e.htm
"Committee establishes work programme to address food security, reviews farm policies",News item,https://www.wto.org/english/news_e/news22_e/acc_22nov22_e.htm
"DDG González: Timely and quality market information is key to transparency, food security",News item,https://www.wto.org/english/news_e/news22_e/agri_18nov22_e.htm
"WTO, FAO study calls for global action to improve access to fertilizers, avert food crisis",News item,https://www.wto.org/english/news_e/news22_e/igo_14nov22_e.htm
DG Okonjo-Iweala: Trade is essential part of climate action efforts to achieve food security,News item,https://www.wto.org/english/news_e/news22_e/fsec_08nov22_e.htm
DDG Paugam: More collective efforts needed to address food crisis,News item,https://www.wto.org/english/news_e/news22_e/agri_04nov22_e.htm
"France gives EUR 50,000 to boost safe food exports from developing countries",Press release,https://www.wto.org/english/news_e/pres22_e/pr910_e.htm
"Count on WTO in coordinated action to fight food security crisis, says DDG Paugam",News item,https://www.wto.org/english/news_e/news22_e/ddgjp_10oct22_e.htm
Agency heads call for urgent action to address global food security crisis,News item,https://www.wto.org/english/news_e/news22_e/igo_21sep22_e.htm
"Agriculture meeting highlights food security, urgency of implementing MC12 outcomes",News item,https://www.wto.org/english/news_e/news22_e/agri_14sep22_e.htm
DDG Paugam calls on WTO Chairs Programme to contribute fresh ideas to food security debate,News item,https://www.wto.org/english/news_e/news22_e/ddgjp_26jul22_e.htm
DG Okonjo-Iweala to African Union: MC12 outcomes will make a material difference for people,News item,https://www.wto.org/english/news_e/news22_e/dgno_17jul22_e.htm
"DG Okonjo-Iweala underlines vital role of trade in addressing food crisis, inflation",News item,https://www.wto.org/english/news_e/news22_e/dgno_15jul22_e.htm
Heads of agencies call for urgent action to address global food security crisis,News item,https://www.wto.org/english/news_e/news22_e/igo_15jul22_e.htm
"Agriculture meeting discusses MC12 outcomes, food security, Nairobi and Bali decisions",News item,https://www.wto.org/english/news_e/news22_e/agri_27jun22_e.htm
WTO members secure unprecedented package of trade outcomes at MC12,News item,https://www.wto.org/english/news_e/news22_e/mc12_17jun22_e.htm
"WTO response to the pandemic, trade and food security take centre stage at MC12",News item,https://www.wto.org/english/news_e/news22_e/mc12_13jun22_e.htm
DDG Paugam: WTO is actively participating in efforts to preserve global food security,News item,https://www.wto.org/english/news_e/news22_e/ddgjp_25may22_e.htm
DG Okonjo-Iweala: Trade has central role in addressing food security challenges,News item,https://www.wto.org/english/news_e/news22_e/sps_26apr22_e.htm
"World Bank, IMF, WFP and WTO call for urgent coordinated action on food security",News item,https://www.wto.org/english/news_e/news22_e/igo_13apr22_e.htm
"Agriculture Committee’s 100th session discusses food security, farm policies, Nairobi Decision",News item,https://www.wto.org/english/news_e/news22_e/agri_16mar22_e.htm
"DDG Paugam underscores important role of trade for food security, sustainable land use",News item,https://www.wto.org/english/news_e/news22_e/ddgjp_28jan22_e.htm
DG Okonjo-Iweala highlights vital role of trade for global food security,News item,https://www.wto.org/english/news_e/news21_e/dgno_06jul21_e.htm
