title,type,url
Youth Trade Summit emphasizes contribution of youth to the trade and gender debate,News item,https://www.wto.org/english/news_e/news23_e/women_14nov23_e.htm
WTO training course on trade and gender for Geneva-based delegates concludes,News item,https://www.wto.org/english/news_e/news23_e/women_06nov23_e.htm
Registration opens for the Youth Trade Summit on Gender,News item,https://www.wto.org/english/news_e/news23_e/women_17oct23_e.htm
"DG Okonjo-Iweala: Trade is important for innovation, women’s economic empowerment, climate",News item,https://www.wto.org/english/news_e/news23_e/msmes_28sep23_e.htm
Trade and Gender co-chairs outline joint work with MSMEs Group for women entrepreneurs,News item,https://www.wto.org/english/news_e/news23_e/women_22sep23_e.htm
New WTO publication underlines need to boost women’s participation in trade,News item,https://www.wto.org/english/news_e/news23_e/women_14sep23_e.htm
Government officials complete training course on promoting gender equality in trade,News item,https://www.wto.org/english/news_e/news23_e/tra_20jul23_e.htm
Nomination deadline for Youth Trade Summit on Gender extended to 12 September,News item,https://www.wto.org/english/news_e/news23_e/women_10jul23_e.htm
Trade and Gender Informal Working Group co-chairs launch work plan for 2023-24,News item,https://www.wto.org/english/news_e/news23_e/iwgtg_20jun23_e.htm
Youth Trade Summit on Gender to foster next generation of trade and gender experts,News item,https://www.wto.org/english/news_e/news23_e/women_12jun23_e.htm
Applications invited for WTO Training Course on Trade and Gender,News item,https://www.wto.org/english/news_e/news23_e/tra_30may23_e.htm
Gender-responsive trade policymaking skills enhanced for 23 government officials,News item,https://www.wto.org/english/news_e/news23_e/women_05may23_e.htm
"WTO, FIFA event highlights role of football as a tool for trade and women’s empowerment",News item,https://www.wto.org/english/news_e/news23_e/women_01may23_e.htm
El Salvador minister calls on WTO members to take action on promoting gender equality,News item,https://www.wto.org/english/news_e/news23_e/iwgtg_24apr23_e.htm
DDG Zhang: Women’s perspectives are crucial to achieve sustainable peace through trade,News item,https://www.wto.org/english/news_e/news23_e/ddgxz_31mar23_e.htm
Deadline for applying to the WTO Training on Trade and Gender extended to 20 March,News item,https://www.wto.org/english/news_e/news23_e/women_13mar23_e.htm
"Members share experiences on environmental regulations, standards for climate and plastics",News item,https://www.wto.org/english/news_e/news23_e/tbt_10mar23_e.htm
"Combat inequality amid global upheavals, Okonjo-Iweala and Lagarde urge on Women’s Day",News item,https://www.wto.org/english/news_e/news23_e/women_08mar23_e.htm
WTO Gender Research Hub launches work programme to deepen expertise on women in trade,News item,https://www.wto.org/english/news_e/news23_e/women_09mar23_e.htm
DDG Ellard: We need to make trade work for women,News item,https://www.wto.org/english/news_e/news23_e/ddgae_07mar23_e.htm
Applications now open for WTO Training Course on Trade and Gender,News item,https://www.wto.org/english/news_e/news23_e/women_28feb23_e.htm
DG Okonjo-Iweala and Christine Lagarde to exchange views at International Women’s Day event,News item,https://www.wto.org/english/news_e/news23_e/women_20feb23_e.htm
Trade and Gender Informal Working Group co-chairs present draft work plan for 2023,News item,https://www.wto.org/english/news_e/news23_e/women_15feb23_e.htm
"Members highlight progress on trade and gender, aim for long-term work programme in 2023",News item,https://www.wto.org/english/news_e/news22_e/women_12dec22_e.htm
World Trade Congress on Gender,News item,https://www.wto.org/english/news_e/news22_e/women_07dec22_e.htm
World Trade Congress on Gender,News item,https://www.wto.org/english/news_e/news22_e/ddgae_07dec22_e.htm
World Trade Congress on Gender closes with call for further action on women’s empowerment,News item,https://www.wto.org/english/news_e/news22_e/women_08dec22_e.htm
"Trade and gender congress opens with call for inclusive, research-backed path to recovery",News item,https://www.wto.org/english/news_e/news22_e/women_05dec22_e.htm
World Trade Congress on Gender programme is now available,News item,https://www.wto.org/english/news_e/news22_e/women_22nov22_e.htm
Five gender equality advocates chosen as ambassadors of the World Trade Congress on Gender,News item,https://www.wto.org/english/news_e/news22_e/women_17nov22_e.htm
WTO opens registration for the World Trade Congress on Gender,News item,https://www.wto.org/english/news_e/news22_e/women_01nov22_e.htm
"With right tools and policies, women can break the glass ceiling in trade — DG Okonjo-Iweala",News item,https://www.wto.org/english/news_e/news22_e/dgno_29sep22_e.htm
"WTO, FIFA team up to use trade and football as drivers of economic and social development",News item,https://www.wto.org/english/news_e/news22_e/igo_27sep22_e.htm
Members agree next steps on trade and gender work post MC12,News item,https://www.wto.org/english/news_e/news22_e/women_22sep22_e.htm
DG Okonjo-Iweala: Global trade a powerful instrument for improving the lives of women,News item,https://www.wto.org/english/news_e/news22_e/dgno_22sep22_e.htm
WTO launches database on gender equality provisions in regional trade agreements,News item,https://www.wto.org/english/news_e/news22_e/women_28jul22_e.htm
WTO Gender Research Hub outlines data collection methodologies and statistical gaps on women in trade,News item,https://www.wto.org/english/news_e/news22_e/women_27jul22_e.htm
Trade and gender co-chairs affirm commitment to gender equality in trade at MC12,News item,https://www.wto.org/english/news_e/news22_e/iwgtg_13jun22_e.htm
Members urged to address needs of women entrepreneurs at MC12 event,News item,https://www.wto.org/english/news_e/news22_e/women_12jun22_e.htm
Spring sessions of WTO Training Course on Trade and Gender concludes for officials,News item,https://www.wto.org/english/news_e/news22_e/women_13may22_e.htm
World Trade Congress on Gender: Deadline for submitting papers extended to 1 July,News item,https://www.wto.org/english/news_e/news22_e/women_04may22_e.htm
WTO launches new database compiling over 100 studies on gender equality in trade,News item,https://www.wto.org/english/news_e/news22_e/women_29apr22_e.htm
WTO Gender Research Hub thinks up ways to address gender gaps in trade finance,News item,https://www.wto.org/english/news_e/news22_e/women_09mar22_e.htm
DG Okonjo-Iweala: Women must be at the centre of trade for a more prosperous future,News item,https://www.wto.org/english/news_e/news22_e/dgno_08mar22_e.htm
WTO Secretariat initiates gender equality and inclusion audit on International Women’s Day,News item,https://www.wto.org/english/news_e/news22_e/devel_08mar22_e.htm
WTO Gender Research Hub launches call for papers for first World Trade Congress on Gender,News item,https://www.wto.org/english/news_e/news22_e/women_08mar22_e.htm
"DDG Ellard highlights WTO-ILO collaboration on inclusive trade, opportunities for women",News item,https://www.wto.org/english/news_e/news22_e/ddgae_02mar22_e.htm
WTO Gender Research Hub kicks off Think Up! series with discussion on trade finance gap,News item,https://www.wto.org/english/news_e/news22_e/women_28feb22_e.htm
Applications now open for the WTO Training Course on Trade and Gender,News item,https://www.wto.org/english/news_e/news22_e/women_17feb22_e.htm
DDG Ellard: “Deeds not words” as the WTO becomes more gender-responsive,News item,https://www.wto.org/english/news_e/news22_e/ddgae_27jan22_e.htm
DDG Ellard: WTO is taking action to make trade work for women,News item,https://www.wto.org/english/news_e/news21_e/ddgae_17dec21_e.htm
Vital role of trade policy for women and the environment stressed at clean cooking event,News item,https://www.wto.org/english/news_e/news21_e/ddgjp_25oct21_e.htm
"Aid for Trade monitoring exercise to look into sustainability, women’s economic empowerment",News item,https://www.wto.org/english/news_e/news21_e/aid_22oct21_e.htm
Trade and Gender Informal Working Group co-chairs present draft outcome document for MC12,News item,https://www.wto.org/english/news_e/news21_e/women_23sep21_e.htm
DDG González underscores importance of women’s economic empowerment in trade,News item,https://www.wto.org/english/news_e/news21_e/ddgno_09aug21_e.htm
Members discuss how Aid for Trade can support women’s economic empowerment,News item,https://www.wto.org/english/news_e/news21_e/iwgtg_16jul21_e.htm
Participants in services regulation talks outline steps taken to implement new disciplines,News item,https://www.wto.org/english/news_e/news21_e/serv_14jun21_e.htm
WTO launches Gender Research Hub to promote cooperation on trade and gender issues,News item,https://www.wto.org/english/news_e/news21_e/iwgtg_31may21_e.htm
Members of Trade and Gender Informal Working Group discuss women empowerment initiatives,News item,https://www.wto.org/english/news_e/news21_e/women_28apr21_e.htm
Members of Informal Working Group on Trade and Gender agree on work plan for 2021,News item,https://www.wto.org/english/news_e/news21_e/women_12mar21_e.htm
2021 WTO International Women’s Day: “Women in Leadership: Achieving an Equal Future in a COVID-19 World”,Speech,https://www.wto.org/english/news_e/spno_e/spno2_e.htm
International Women’s Day: Focus on women for a stronger recovery,News item,https://www.wto.org/english/news_e/news21_e/women_08mar21_e.htm
Members discuss work plan at first meeting of Informal Working Group on Trade and Gender,News item,https://www.wto.org/english/news_e/news20_e/women_10dec20_e.htm
Trade and Gender — Virtual Meeting,News item,https://www.wto.org/english/news_e/news20_e/ddgya_23sep20_e.htm
New WTO working group established to deepen trade and gender discussions,News item,https://www.wto.org/english/news_e/news20_e/women_23sep20_e.htm
WTO report draws attention to impact of COVID-19 trade disruptions on women,News item,https://www.wto.org/english/news_e/news20_e/covid_05aug20_e.htm
"WTO, World Bank launch joint publication on the role of trade in empowering women",News item,https://www.wto.org/english/news_e/news20_e/rese_30jul20_e.htm
DG Azevêdo on Women’s Day: WTO has important role to play in promoting gender equality,Speech,https://www.wto.org/english/news_e/spra_e/spra302_e.htm
Azevêdo: Inclusive growth means closing gender gaps,News item,https://www.wto.org/english/news_e/news19_e/dgra_30sep19_e.htm
Economic diversification and empowerment of women key to bridge development gaps,News item,https://www.wto.org/english/news_e/news19_e/gr19_04jul19_e.htm
More work needed to tackle barriers women entrepreneurs face in trade says DG Azevêdo,Speech,https://www.wto.org/english/news_e/spra_e/spra275_e.htm
DG Azevêdo: Global cooperation on digital economy vital to unlock trade benefits for women,Speech,https://www.wto.org/english/news_e/spra_e/spra268_e.htm
Mexico Chair participates in workshop on women’s economic empowerment in India,News item,https://www.wto.org/english/news_e/news19_e/chair_17apr19_e.htm
DG Azevêdo highlights role of trade agreements in enhancing women’s empowerment,News item,https://www.wto.org/english/news_e/news19_e/women_28mar19_e.htm
Workshop on Gender Considerations in Trade Agreements,Speech,https://www.wto.org/english/news_e/spra_e/spra253_e.htm
New EIF initiative targets economic empowerment of women in least developed countries,News item,https://www.wto.org/english/news_e/news19_e/if_27mar19_e.htm
"Trade and gender training, new research and EIF initiative announced on Women’s Day at WTO",News item,https://www.wto.org/english/news_e/news19_e/women_08mar19_e.htm
"“Gender issues are central to who we are,” says DG Azevêdo on Women’s Day",Speech,https://www.wto.org/english/news_e/spra_e/spra251_e.htm
DG Azevêdo meets with members of the UN Working Group on business and human rights,News item,https://www.wto.org/english/news_e/news19_e/dgra_08feb19_e.htm
Workshop on Women in Global Value Chains,Speech,https://www.wto.org/english/news_e/spra_e/spra237_e.htm
Azevêdo stresses role of trade in helping women participate fully in the global economy,News item,https://www.wto.org/english/news_e/news18_e/women_01oct18_e.htm
"Workshop on Trade, Gender and Government Procurement",Remarks by DG Azevêdo,https://www.wto.org/english/news_e/spra_e/spra226_e.htm
DG Azevêdo: Government procurement is an effective tool to support women-led businesses,News item,https://www.wto.org/english/news_e/news18_e/women_25jun18_e.htm
DG Azevêdo: Better data needed to make trade work for women’s economic empowerment,News item,https://www.wto.org/english/news_e/news18_e/women_19mar18_e.htm
IWD 2018 : WTO International Women’s Day — Delivering Opportunities For Women,Remarks by DG Azevêdo,https://www.wto.org/english/news_e/spra_e/spra215_e.htm
WTO event highlights role of trade in delivering opportunities for women,News item,https://www.wto.org/english/news_e/news18_e/women_08mar18_e.htm
Trade Policy Review: The Gambia,TPR documents,https://www.wto.org/english/tratop_e/tpr_e/tp465_e.htm
Trade Policy Review: The Gambia,Chairperson’s concluding remarks,https://www.wto.org/english/tratop_e/tpr_e/tp465_crc_e.htm
Trade Policy Review: The Gambia,Audio: Chairperson’s concluding remarks,https://www.wto.org/audio/tp465.mp3
Buenos Aires Declaration on Women and Trade outlines actions to empower women,News item,https://www.wto.org/english/news_e/news17_e/mc11_12dec17_e.htm
Workshop on trade and inclusive growth takes place at University of Jordan,News item,https://www.wto.org/english/news_e/news17_e/chair_10nov17_e.htm
Removing barriers to women’s participation in trade critical for economic development,News item,https://www.wto.org/english/news_e/news17_e/gr17_12jul17_e.htm
2017 Global Review of Aid for Trade: Plenary session — promoting inclusive trade through gender empowerment,Remarks by DG Azevêdo,https://www.wto.org/english/news_e/spra_e/spra185_e.htm
"Sustainable fishing, climate change among issues aired at trade and environment committee",News item,https://www.wto.org/english/news_e/news17_e/envir_20jun17_e.htm
WTO — International Women’s Day “Towards Gender Equality at the WTO”,DG Remarks,https://www.wto.org/english/news_e/spra_e/spra160_e.htm
WTO Marks International Women’s Day with a focus on Gender Parity In the Organization,News item,https://www.wto.org/english/news_e/news17_e/dgra_08mar17_e.htm
