title,type,url
Dominican Republic appeals panel report regarding duties on steel bars from Costa Rica,News item,https://www.wto.org/english/news_e/news23_e/ds605apl_22sep23_e.htm
China appeals WTO dispute panel report regarding Chinese duties on US products,News item,https://www.wto.org/english/news_e/news23_e/ds558apl_20sep23_e.htm
India appeals panel report regarding Indian tech tariffs,News item,https://www.wto.org/english/news_e/news23_e/ds584apl_25may23_e.htm
"United States appeals panel report regarding US origin marking for Hong Kong, China goods",News item,https://www.wto.org/english/news_e/news23_e/ds597apl_30jan23_e.htm
United States appeals panel reports regarding US duties on steel and aluminium products,News item,https://www.wto.org/english/news_e/news23_e/ds544_552_556_564apl_30jan23_e.htm
Indonesia appeals panel report in dispute regarding Indonesian measures on nickel ore,News item,https://www.wto.org/english/news_e/news22_e/ds592apl_12dec22_e.htm
India appeals panel reports in disputes targeting Indian sugar subsidies,News item,https://www.wto.org/english/news_e/news22_e/ds579_580_581apl_11jan22_e.htm
China appeals panel report regarding US duties on photovoltaic cells,News item,https://www.wto.org/english/news_e/news21_e/ds562apl_20sep21_e.htm
Morocco appeals panel report regarding duties on school books from Tunisia,News item,https://www.wto.org/english/news_e/news21_e/ds578apl_04aug21_e.htm
United States appeals panel report regarding US duties on Korean products,News item,https://www.wto.org/english/news_e/news21_e/ds539apl_19mar21_e.htm
Pakistan appeals panel report regarding duties on BOPP film from the UAE,News item,https://www.wto.org/english/news_e/news21_e/ds538apl_22feb21_e.htm
Korea appeals panel report regarding Korean duties on Japanese steel,News item,https://www.wto.org/english/news_e/news21_e/ds553apl_25jan21_e.htm
Indonesia appeals compliance panel report on chicken import measures,News item,https://www.wto.org/english/news_e/news20_e/ds484apl_17dec20_e.htm
WTO issues compendium of GATT dispute settlement reports,News item,https://www.wto.org/english/news_e/news20_e/publ_14dec20_e.htm
United States appeals panel report regarding US tariffs on Chinese goods,News item,https://www.wto.org/english/news_e/news20_e/ds543apl_26oct20_e.htm
US appeals panel report regarding US duties on Canadian softwood lumber,News item,https://www.wto.org/english/news_e/news20_e/ds533apl_28sep20_e.htm
"EU appeals panel report on EU dumping methodologies, duties on Russian imports",News item,https://www.wto.org/english/news_e/news20_e/ds494apl_28aug20_e.htm
Appellate Body issues annual report for 2019-2020,News item,https://www.wto.org/english/news_e/news20_e/ab_28sep20_e.htm
Saudi Arabia appeals panel report regarding intellectual property measures,News item,https://www.wto.org/english/news_e/news20_e/ds567apl_30jul20_e.htm
Appellate Body issues reports regarding tobacco plain packaging requirements,Appellate Body Report,https://www.wto.org/english/news_e/news20_e/435_441abr_e.htm
WTO Arbitrator determines “reasonable period of time” in Ukraine-Russia dumping dispute,Decision of the Arbitrator,https://www.wto.org/english/news_e/news20_e/493arb2_e.htm
Appellate Body issues report regarding US duties on Canadian paper,Appellate Body Report,https://www.wto.org/english/news_e/news20_e/505abr_e.htm
Appellate Body issues report regarding Russian measures on imported railway equipment,Appellate Body Report,https://www.wto.org/english/news_e/news20_e/499abr_e.htm
Appellate Body issues report regarding Moroccan duties on Turkish steel,Appellate Body Report,https://www.wto.org/english/news_e/news19_e/513abr_e.htm
DG Azevêdo to launch intensive consultations on resolving Appellate Body impasse,News item,https://www.wto.org/english/news_e/news19_e/gc_09dec19_e.htm
European Union appeals second compliance panel ruling in Airbus dispute,News item,https://www.wto.org/english/news_e/news19_e/ds316oth_06dec19_e.htm
India appeals panel report regarding export promotion measures,News item,https://www.wto.org/english/news_e/news19_e/ds541apl_19nov19_e.htm
WTO pays tribute to former Appellate Body member Luiz Olavo Baptista,News item,https://www.wto.org/english/news_e/news19_e/ab_18oct19_e.htm
Registration opens for public viewing of oral hearing in “US — Supercalendered Paper” appeal,News item,https://www.wto.org/english/news_e/news19_e/hear_ds505_07oct19_e.htm
Appellate Body issues report regarding Ukrainian duties on ammonium nitrate from Russia,Appellate Body Report,https://www.wto.org/english/news_e/news19_e/493abr_e.htm
Appellate Body issues report regarding Korean duties on Japanese pneumatic valves,Appellate Body Report,https://www.wto.org/english/news_e/news19_e/504abr_e.htm
Thailand appeals second compliance panel report regarding Thai cigarette import measures,News item,https://www.wto.org/english/news_e/news19_e/ds371apl_09sep19_e.htm
United States appeals panel report regarding renewable energy measures,News item,https://www.wto.org/english/news_e/news19_e/ds510apl_15aug19_e.htm
Appellate Body issues report on US compliance with countervailing duties ruling,Appellate Body Report,https://www.wto.org/english/news_e/news19_e/437abrw_e.htm
WTO hosts final round of John H. Jackson Moot Court Competition,News item,https://www.wto.org/english/news_e/news19_e/stud_08jun19_e.htm
WTO issues updated dispute settlement case summaries,News item,https://www.wto.org/english/news_e/news19_e/disp_06jun19_e.htm
Canada appeals panel report regarding US dumping duties on Canadian lumber,News item,https://www.wto.org/english/news_e/news19_e/ds534apl_04jun19_e.htm
Launch of the Appellate Body Annual Report for 2018,News item,https://www.wto.org/english/news_e/news19_e/ab_29may19_e.htm
Appellate Body issues report regarding Korean restrictions on Japanese food imports,Appellate Body Report,https://www.wto.org/english/news_e/news19_e/495abr_e.htm
Appellate Body issues report on US compliance in the Boeing dispute,Appellate Body Report,https://www.wto.org/english/news_e/news19_e/353abrw_e.htm
United States appeals panel report regarding US duties on Turkish pipe and tube products,News item,https://www.wto.org/english/news_e/news19_e/ds523apl_28jan19_e.htm
General Council Chair appoints facilitator to address disagreement on Appellate Body,News item,https://www.wto.org/english/news_e/news19_e/gc_18jan19_e.htm
Thailand appeals compliance panel report regarding Thai measures on imported cigarettes,News item,https://www.wto.org/english/news_e/news19_e/ds371apl_09jan19_e.htm
Appellate Body issues report on revised US “dolphin-safe” tuna labelling measure,Appellate Body Report,https://www.wto.org/english/news_e/news18_e/381abrw2_e.htm
India appeals panel ruling in dispute with Japan over safeguard duties on steel products,News item,https://www.wto.org/english/news_e/news18_e/ds518apl_14dec18_e.htm
Appellate Body issues report regarding Brazil tax measures,Appellate Body Report,https://www.wto.org/english/news_e/news18_e/472_497abr_e.htm
Morocco files appeal against panel ruling in dispute with Turkey over steel duties,News item,https://www.wto.org/english/news_e/news18_e/ds513apl_20nov18_e.htm
Panama files appeal against compliance panel ruling in dispute with Colombia over import measures,News item,https://www.wto.org/english/news_e/news18_e/ds461oth_21nov18_e.htm
European Union files appeal in dispute with Russia over energy sector measures,News item,https://www.wto.org/english/news_e/news18_e/ds476apl_21sep18_e.htm
United States files appeal in dispute with Canada over US paper duties,News item,https://www.wto.org/english/news_e/news18_e/ds505apl_27aug18_e.htm
Ukraine files appeal in dispute with Russia over railway equipment import restrictions,News item,https://www.wto.org/english/news_e/news18_e/ds499apl_27aug18_e.htm
The Dominican Republic files appeal against WTO panel ruling on tobacco plain packaging requirements,News item,https://www.wto.org/english/news_e/news18_e/ds441apl_23aug18_e.htm
Ukraine files appeal against WTO panel ruling on anti-dumping measures on ammonium nitrate,News item,https://www.wto.org/english/news_e/news18_e/ds493apl_23aug18_e.htm
Appellate Body issues report regarding Indonesian metal duties,Appellate Body Report,https://www.wto.org/english/news_e/news18_e/490_496abr_e.htm
Honduras files appeal against WTO panel ruling on tobacco plain packaging requirements,News item,https://www.wto.org/english/news_e/news18_e/ds435apl_19jul18_e.htm
"“Unprecedented challenges” confront Appellate Body, chair warns",News item,https://www.wto.org/english/news_e/news18_e/ab_22jun18_e.htm
Japan files appeal against panel ruling regarding Korean duties on pneumatic valves,News item,https://www.wto.org/english/news_e/news18_e/ds504apl_29may18_e.htm
Appellate Body issues report regarding EU subsidy duties on PET from Pakistan,Appellate Body Report,https://www.wto.org/english/news_e/news18_e/486abr_e.htm
Appellate Body issues report on EU compliance in Airbus dispute,Appellate Body Report,https://www.wto.org/english/news_e/news18_e/316abrw_e.htm
Appellate Body chair calls for “constructive dialogue” on addressing dispute settlement concerns,News item,https://www.wto.org/english/news_e/news18_e/ab_07may18_e.htm
US files appeal against compliance panel ruling in countervailing duty dispute with China,News item,https://www.wto.org/english/news_e/news18_e/ds437_24apl_30apr18_e.htm
Korea files appeal against WTO panel ruling regarding Japanese food import restrictions,News item,https://www.wto.org/english/news_e/news18_e/ds495_8apl_09apr18_e.htm
"Appellate Body issues report regarding Russian duties on vehicle imports from Germany, Italy",Appellate Body Report,https://www.wto.org/english/news_e/news18_e/479abr_e.htm
WTO Arbitrator determines “reasonable period of time” in US-China anti-dumping dispute,Decision of the Arbitrator,https://www.wto.org/english/news_e/news18_e/471arb2_e.htm
Mexico appeals compliance panel rulings on revised US “dolphin-safe” tuna labelling measure,News item,https://www.wto.org/english/news_e/news17_e/ds381apl_01dec17_e.htm
Appellate Body issues report regarding Indonesian import restrictions,Appellate Body Report,https://www.wto.org/english/news_e/news17_e/477_478abr_e.htm
Indonesia files appeal against WTO panel ruling on steel safeguard,News item,https://www.wto.org/english/news_e/news17_e/ds490_4_496_5apl_29sep17_e.htm
Brazil files appeal against WTO panel ruling on tax measures,News item,https://www.wto.org/english/news_e/news17_e/ds472_8_497_6apl_29sep17_e.htm
Appellate Body issues report regarding EU anti-dumping measures on fatty alcohols from Indonesia,Appellate Body Report,https://www.wto.org/english/news_e/news17_e/442abr_e.htm
Appellate Body issues report regarding US tax breaks for civil aircraft production,Appellate Body Report,https://www.wto.org/english/news_e/news17_e/487abr_e.htm
EU files appeal against panel ruling regarding EU duties on PET from Pakistan,News item,https://www.wto.org/english/news_e/news17_e/ds486apl_30aug17_e.htm
Appellate Body member Hyun Chong Kim resigns,News item,https://www.wto.org/english/news_e/news17_e/ab_01aug17_e.htm
Registration opens for public viewing of oral hearing in “US — Tax Incentives” appeal,News item,https://www.wto.org/english/news_e/news17_e/hear_ds487_16jun17_e.htm
"Appellate Body faces challenges in meeting demands for its services, chairman warns",News item,https://www.wto.org/english/news_e/news17_e/ab_08jun17_e.htm
Appellate Body issues report regarding US anti-dumping investigations on Chinese products,Appellate Body Report,https://www.wto.org/english/news_e/news17_e/471abr_e.htm
WTO Arbitrator determines “reasonable period of time” in US washers dispute,Decision of the Arbitrator,https://www.wto.org/english/news_e/news17_e/464arb2_e.htm
"Appellate Body issues report regarding Russian import restrictions on pigs, pork from EU",Appellate Body Report,https://www.wto.org/english/news_e/news17_e/475abr_e.htm
Russia files appeal against WTO panel ruling on vehicle duties,News item,https://www.wto.org/english/news_e/news17_e/ds479_6apl_21feb17_e.htm
Indonesia files appeal against WTO panel ruling on agricultural import measures,News item,https://www.wto.org/english/news_e/news17_e/ds477_11_478_11apl_17feb17_e.htm
Indonesia files appeal against WTO panel ruling on EU dumping duties on fatty alcohol,News item,https://www.wto.org/english/news_e/news17_e/ds442_5apl_13feb17_e.htm
WTO welcomes two new Appellate Body members,News item,https://www.wto.org/english/news_e/news17_e/ab_25jan17_e.htm
US files appeal against WTO panel ruling on tax breaks for civil aircraft production,News item,https://www.wto.org/english/news_e/news16_e/ds487apl_16dec16_e.htm
"Chair reports on state of Appellate Body, warns of surge in cases",News item,https://www.wto.org/english/news_e/news16_e/ab_22nov16_e.htm
China files appeal against WTO panel ruling on US anti-dumping methodologies,News item,https://www.wto.org/english/news_e/news16_e/ds471apl_18nov16_e.htm
WTO Arbitrator determines “reasonable period of time” in Colombia Textiles dispute,Decision of the Arbitrator,https://www.wto.org/english/news_e/news16_e/461arb2_e.htm
Appellate Body issues report regarding EU duties on biodiesel from Argentina,Appellate Body Report,https://www.wto.org/english/news_e/news16_e/473abr_e.htm
Russian Federation files appeal against WTO panel ruling on pork import restrictions,News item,https://www.wto.org/english/news_e/news16_e/ds475apl_26sep16_e.htm
WTO panel issues compliance report on US challenge to EU aircraft subsidies,Panel Report,https://www.wto.org/english/news_e/news16_e/316abrw_e.htm
Appellate Body issues report on India’s domestic content requirements for solar products,Appellate Body Report,https://www.wto.org/english/news_e/news16_e/456abr_e.htm
Appellate Body issues report in Korea/United States washers dispute,Appellate Body Report,https://www.wto.org/english/news_e/news16_e/464abr_e.htm
DG Azevêdo pays tribute to Prof. John Jackson and Amb. Julio Lacarte Muró,Speech,https://www.wto.org/english/news_e/spra_e/spra127_e.htm
Appellate Body issues report in Panama/Colombia tariff dispute,Appellate Body Report,https://www.wto.org/english/news_e/news16_e/461abr_e.htm
WTO members debate appointment/reappointment of Appellate Body members,Summary of the meeting,https://www.wto.org/english/news_e/news16_e/dsb_23may16_e.htm
WTO members debate appointment/reappointment of Appellate Body members,Proposed items for consideration at the DSB,https://www.wto.org/english/news_e/news16_e/dsb_agenda_23may16_e.htm
EU appeals panel report in biodiesel dispute with Argentina,News item,https://www.wto.org/english/news_e/news16_e/ds473apl_20may16_e.htm
India appeals panel report in dispute with US over solar cells and solar modules,News item,https://www.wto.org/english/news_e/news16_e/ds456apl_20apr16_e.htm
US appeals panel report on large residential washers from Korea,News item,https://www.wto.org/english/news_e/news16_e/ds464apl_19apr16_e.htm
Appellate Body issues report in Panama/Argentina dispute,Appellate Body Report,https://www.wto.org/english/news_e/news16_e/453abr_e.htm
Appellate Body mourns the loss of Julio Lacarte,News item,https://www.wto.org/english/news_e/news16_e/ab_04mar16_e.htm
"DG Azevêdo pays tribute to Julio Lacarte-Muró, Dean of GATT and WTO negotiations",News item,https://www.wto.org/english/news_e/news16_e/dgra_07mar16_e.htm
DSB launches selection process for Appellate Body vacancy,Summary of the meeting,https://www.wto.org/english/news_e/news16_e/dsb_25jan16_e.htm
DSB launches selection process for Appellate Body vacancy,Proposed items for consideration at the DSB,https://www.wto.org/english/news_e/news16_e/dsb_agenda_25jan16_e.htm
"Colombia appeals panel report on imports of textiles, apparel and footwear from Panama",News item,https://www.wto.org/english/news_e/news16_e/ds461apl_22jan16_e.htm
Arbitrator determines “reasonable period of time” in Peru-Guatemala agricultural dispute,Decision of the Arbitrator,https://www.wto.org/english/news_e/news15_e/457arb2_e.htm
Appellate Body expresses regret at the passing of Florentino Feliciano,News item,https://www.wto.org/english/news_e/news15_e/ab_15dec15_e.htm
Arbitrator determines “reasonable period of time” in US-Viet Nam anti-dumping dispute,Decision of the Arbitrator,https://www.wto.org/english/news_e/news15_e/429arb2_e.htm
"Arbitrator issues decision in “COOL” case between US, Mexico and Canada",Decision of the Arbitrator,https://www.wto.org/english/news_e/news15_e/384_386arb_e.htm
Appellate Body issues compliance report on US dispute with Mexico over tuna,Appellate Body Report,https://www.wto.org/english/news_e/news15_e/381abrw_e.htm
Panama appeals panel report on measures relating to trade in goods and services,News item,https://www.wto.org/english/news_e/news15_e/ds453apl_27oct15_e.htm
"Appellate Body issues reports on EU, Japan complaints against Chinese steel duties",Appellate Body Report,https://www.wto.org/english/news_e/news15_e/460abr_e.htm
WTO Arbitrator determines “reasonable period of time” in US-China duties dispute,Decision of the Arbitrator,https://www.wto.org/english/news_e/news15_e/437arb2_e.htm
EU appeals compliance panel report on dispute with China over fastener duties,News item,https://www.wto.org/english/news_e/news15_e/ds397apl_09sep15_e.htm
Arbitrator appointed in US — China countervailing dispute,News item,https://www.wto.org/english/news_e/news15_e/ab_20jul15_e.htm
Appellate Body issues report on Peru’s import duties on agricultural products,Appellate Body Report,https://www.wto.org/english/news_e/news15_e/457abr_e.htm
Appellate Body issues annual report for 2014,News item,https://www.wto.org/english/news_e/news15_e/ab_03jul15_e.htm
United States appeals compliance panel report on dispute with Mexico over tuna,News item,https://www.wto.org/english/news_e/news15_e/ds381apl_05jun15_e.htm
Appellate Body issues report on India’s import measures,Appellate Body Report,https://www.wto.org/english/news_e/news15_e/430abr_e.htm
WTO’s dispute settlement has helped curb protectionism—Azevêdo,Speech,https://www.wto.org/english/news_e/spra_e/spra63_e.htm
WTO’s dispute settlement has helped curb protectionism—Azevêdo,"Opening remarks by Mr. Roberto Azevêdo, Director-General (WTO)",https://www.wto.org/audio/2015_06_01dgspeech.mp3
China and Japan appeal panel reports on anti-dumping duties on steel tubes,News item,https://www.wto.org/english/news_e/news15_e/ds460_454apl_20may15_e.htm
Appellate Body issues report on “United States — Country of origin labelling requirements”,Appellate Body Report,https://www.wto.org/english/news_e/news15_e/384_386abrw_e.htm
Appellate Body issues report on United States’ anti-dumping measures,Appellate Body Report,https://www.wto.org/english/news_e/news15_e/429abr_e.htm
Peru appeals panel report on additional duty on certain agricultural products,News item,https://www.wto.org/english/news_e/news15_e/ds457apl_25mar15_e.htm
India appeals panel report on agricultural import measures,News item,https://www.wto.org/english/news_e/news15_e/ds430apl_26jan15_e.htm
Registration opens for public viewing of oral hearing in “US-COOL” appeal,News item,https://www.wto.org/english/news_e/news15_e/hear_ds384_386_21jan15_e.htm
Appellate Body issues report on Argentina’s import measures,Appellate Body Report,https://www.wto.org/english/news_e/news15_e/438_444_445abr_e.htm
Viet Nam appeals panel report on shrimp dispute,News item,https://www.wto.org/english/news_e/news15_e/ds429apl_06jan15_e.htm
Appellate Body issues report on China-US dispute over countervailing duty measures,Appellate Body Report,https://www.wto.org/english/news_e/news14_e/437abr_e.htm
Appellate Body issues report on India-US steel dispute,Appellate Body Report,https://www.wto.org/english/news_e/news14_e/436abr_e.htm
US appeals panel reports in “US-COOL” disputes,News item,https://www.wto.org/english/news_e/news14_e/ds384_386apl_28nov14_e.htm
New member of the Appellate Body is sworn in,News item,https://www.wto.org/english/news_e/news14_e/ab_20oct14_e.htm
WTO appoints new Appellate Body member,Press release,https://www.wto.org/english/news_e/pres14_e/pr723_e.htm
Argentina appeals panel reports on import measures,News item,https://www.wto.org/english/news_e/news14_e/ds438_444_445apl_26sep14_e.htm
China appeals panel report on countervailing measures applied by United States,News item,https://www.wto.org/english/news_e/news14_e/ds437apl_22aug14_e.htm
India files notice of appeal in steel products dispute,News item,https://www.wto.org/english/news_e/news14_e/ds436apl_11aug14_e.htm
Appellate Body issues reports on rare earth disputes,Appellate Body Reports,https://www.wto.org/english/news_e/news14_e/431_432_433abr_e.htm
Appellate Body issues report on US measures on Chinese products,Appellate Body Report,https://www.wto.org/english/news_e/news14_e/449abr_e.htm
Appellate Body issues reports on seal products dispute,Appellate Body Report,https://www.wto.org/english/news_e/news14_e/400_401abr_e.htm
China files notice of appeal in rare earth disputes,News item,https://www.wto.org/english/news_e/news14_e/ds432_433apl_25apr14_e.htm
Appeals announced by China in rare earths dispute and by US in products from China dispute,News item,https://www.wto.org/english/news_e/news14_e/ds449apl_17apr14_e.htm
Appellate Body circulates Post-Employment Guidelines in respect of former Appellate Body Members and former Appellate Body Secretariat staff,News item,https://www.wto.org/english/news_e/news14_e/ab_16apr14_e.htm
US appeals rare earth panel report,News item,https://www.wto.org/english/news_e/news14_e/ds431apl_08apr14_e.htm
China appeals panel report on US countervailing and anti-dumping measures,News item,https://www.wto.org/english/news_e/news14_e/ds449apl_08apr14_e.htm
Chair of the Appellate Body presents Annual Report for 2013,News item,https://www.wto.org/english/news_e/news14_e/ab_19mar14_e.htm
Appellate Body issues Annual Report for 2013,News item,https://www.wto.org/english/news_e/news14_e/ab_14mar14_e.htm
Registration begins for public observation of appeal in the seal products dispute,News item,https://www.wto.org/english/news_e/news14_e/hear_ds400_401_13feb14_e.htm
Canada and Norway appeal seal products reports,News item,https://www.wto.org/english/news_e/news14_e/ds400_401apl_24jan14_e.htm
Appellate Body member re-appointed and Chair re-elected,News item,https://www.wto.org/english/news_e/news13_e/disp_12dec13_e.htm
Appellate Body issues reports on renewable energy dispute,Appellate Body Report,https://www.wto.org/english/news_e/news13_e/412_426abr_e.htm
WTO Arbitrator determines “reasonable period of time” in electrical steel dispute,Award of the Arbitrator,https://www.wto.org/english/news_e/news13_e/414arb2_e.htm
Appellate Body issues Annual Report for 2012,News item,https://www.wto.org/english/news_e/news13_e/ab_09apr13_e.htm
"Japan, EU appeal renewable energy panel reports",News item,https://www.wto.org/english/news_e/news13_e/ds412_426xapl_11feb13_e.htm
Canada appeals renewable energy dispute panel reports,News item,https://www.wto.org/english/news_e/news13_e/ds412_426apl_06feb13_e.htm
Ricardo Ramírez-Hernández elected chair of the Appellate Body,News item,https://www.wto.org/english/news_e/news12_e/ab_14dec12_e.htm
WTO Arbitrator determines “reasonable period of time” in “US-COOL” dispute,Decision of the Arbitrator,https://www.wto.org/english/news_e/news12_e/384_386arb2_e.htm
Appellate Body issues report on China’s duties on steel products from the US,Appellate Body Report,https://www.wto.org/english/news_e/news12_e/414abr_e.htm
China appeals steel dispute panel report,News item,https://www.wto.org/english/news_e/news12_e/ds414apl_20jul12_e.htm
WTO Appellate Body issues reports on US “country of origin” disputes,Appellate Body Report,https://www.wto.org/english/news_e/news12_e/384_386abr_e.htm
Appellate Body welcomes new member,News item,https://www.wto.org/english/news_e/news12_e/ab2_13jun12_e.htm
Appellate Body issues annual report for 2011,News item,https://www.wto.org/english/news_e/news12_e/ab_13jun12_e.htm
WTO appoints new Appellate Body member,Press release,https://www.wto.org/english/news_e/pres12_e/pr662_e.htm
WTO issues Appellate Body report on US/Mexico tuna case,Appellate Body Report,https://www.wto.org/english/news_e/news12_e/381abr_e.htm
Appellate Body issues report on clove cigarettes dispute,Appellate Body Report,https://www.wto.org/english/news_e/news12_e/406abr_e.htm
US appeals COOL dispute panel reports,News item,https://www.wto.org/english/news_e/news12_e/ds384_386apl_23mar12_e.htm
Appellate Body issues report on Boeing dispute,Appellate Body Report,https://www.wto.org/english/news_e/news12_e/353abr_e.htm
Appellate Body issues reports on raw materials disputes,Appellate Body Report,https://www.wto.org/english/news_e/news12_e/394_395_398abr_e.htm
Mexico appeals tuna dispute panel report,News item,https://www.wto.org/english/news_e/news12_e/ds381xapl_25jan12_e.htm
US appeals tuna dispute panel report,News item,https://www.wto.org/english/news_e/news12_e/ds381apl_20jan12_e.htm
US appeals clove cigarettes dispute panel report,News item,https://www.wto.org/english/news_e/news12_e/dsapl_05jan12_e.htm
Appellate Body issues reports on distilled spirits disputes,Appellate Body Report,https://www.wto.org/english/news_e/news11_e/396_403abr_e.htm
Appellate Body welcomes new members,News item,https://www.wto.org/english/news_e/news11_e/ab_08dec11_e.htm
WTO appoints two new Appellate Body members,Press release,https://www.wto.org/english/news_e/pres11_e/pr647_e.htm
EU appeals distilled spirits panel report,News item,https://www.wto.org/english/news_e/news11_e/ds396_403xapl_28sep11_e.htm
