title,type,url
"Members consider five regional trade agreements, discuss improving functioning of Committee",News item,https://www.wto.org/english/news_e/news23_e/rta_05jul23_e.htm
"Members consider five trade agreements, discuss how to improve functioning of Committee",News item,https://www.wto.org/english/news_e/news23_e/rta_27mar23_e.htm
"Working group on small business approves work program, issues a call for papers",News item,https://www.wto.org/english/news_e/news23_e/igmsm_15mar23_e.htm
"Members review trade agreements involving Egypt, Israel, Kenya, Korea, Mexico, Türkiye, UK",News item,https://www.wto.org/english/news_e/news22_e/rta_14nov22_e.htm
Members consider five regional trade agreements,News item,https://www.wto.org/english/news_e/news22_e/rta_22sep22_e.htm
WTO launches database on gender equality provisions in regional trade agreements,News item,https://www.wto.org/english/news_e/news22_e/women_28jul22_e.htm
"WTO members review six free trade agreements, stress importance of transparency",News item,https://www.wto.org/english/news_e/news22_e/rta_27jun22_e.htm
"WTO members review UK-Turkey, UK-Singapore and China-Mauritius trade agreements",News item,https://www.wto.org/english/news_e/news22_e/rta_29mar22_e.htm
"DDG Ellard: Multilateralism is the solution to challenges of global commons, unilateralism",News item,https://www.wto.org/english/news_e/news22_e/ddgae_08feb22_e.htm
DDG Ellard stresses WTO’s commitment to support AfCFTA implementation,News item,https://www.wto.org/english/news_e/news21_e/ddgae_25nov21_e.htm
DDG Ellard underlines co-existence between plurilateral negotiations and multilateralism,News item,https://www.wto.org/english/news_e/news21_e/ddgae_12nov21_e.htm
"WTO issues information briefs on trade, climate, related issues with COP26 talks underway",News item,https://www.wto.org/english/news_e/news21_e/clim_03nov21_e.htm
"WTO members review three RTAs, receive update on Transparency Mechanism",News item,https://www.wto.org/english/news_e/news21_e/rta_01nov21_e.htm
100th session of the Committee on Regional Trade Agreements,Speech,https://www.wto.org/english/news_e/spno_e/spno10_e.htm
WTO members review CPTPP at 100th session of Committee on Regional Trade Agreements,News item,https://www.wto.org/english/news_e/news21_e/rta_22jun21_e.htm
"WTO members consider EU-Singapore, Peru-Australia trade agreements",News item,https://www.wto.org/english/news_e/news21_e/rta_22mar21_e.htm
WTO members consider six regional trade agreements,News item,https://www.wto.org/english/news_e/news20_e/rta_18nov20_e.htm
WTO members review four regional trade agreements between developing countries,News item,https://www.wto.org/english/news_e/news20_e/rta_29sep20_e.htm
"WTO members consider EU-Armenia, MERCOSUR-Israel trade agreements",News item,https://www.wto.org/english/news_e/news20_e/rta_23sep20_e.htm
DDG Wolff: The future belongs to trade agreements of varying geometries,News item,https://www.wto.org/english/news_e/news20_e/ddgaw_11aug20_e.htm
Online regional trade policy course for Caribbean countries under way,News item,https://www.wto.org/english/news_e/news20_e/tech_10aug20_e.htm
WTO members review five regional trade agreements,News item,https://www.wto.org/english/news_e/news20_e/rta_27jul20_e.htm
WTO issues new report on treatment of medical products in regional trade agreements,News item,https://www.wto.org/english/news_e/news20_e/rta_27apr20_e.htm
"WTO members consider EU-Japan, Turkey-Singapore trade agreements",News item,https://www.wto.org/english/news_e/news19_e/rta_08nov19_e.htm
Advanced Course on Regional Trade Agreements and the WTO concludes in Geneva,News item,https://www.wto.org/english/news_e/news19_e/tech_19sep19_e.htm
"Members review regional trade agreements of Pacific Alliance, EAEU members and Viet Nam",News item,https://www.wto.org/english/news_e/news19_e/rta_17sep19_e.htm
WTO members consider six regional trade agreements,News item,https://www.wto.org/english/news_e/news19_e/rta_04apr19_e.htm
Members urge follow-up to Bali decision on monitoring flexibilities for developing countries,News item,https://www.wto.org/english/news_e/news18_e/devel_21nov18_e.htm
"WTO members review regional trade agreements covering EU, Ghana and EAEU",News item,https://www.wto.org/english/news_e/news18_e/rta_19nov18_e.htm
Regional Trade Policy Course concludes in Thailand,News item,https://www.wto.org/english/news_e/news18_e/tech_22oct18_e.htm
"WTO members review two regional trade agreements covering Africa, the Caribbean and the EU",News item,https://www.wto.org/english/news_e/news18_e/rta_18sep18_e.htm
WTO members review four regional trade agreements,News item,https://www.wto.org/english/news_e/news18_e/rta_19jun18_e.htm
DDG Wolff: Regional agreements must contribute to advancing multilateral trade,News item,https://www.wto.org/english/news_e/news18_e/ddgra_17may18_e.htm
WTO members discuss ways of improving the transparency of regional trade agreements,News item,https://www.wto.org/english/news_e/news18_e/rta_09apr18_e.htm
WTO members review three regional trade agreements,News item,https://www.wto.org/english/news_e/news17_e/rta_10nov17_e.htm
"WTO members review Korea-Colombia, Korea-India trade agreements",News item,https://www.wto.org/english/news_e/news17_e/rta_22sep17_e.htm
WTO members review three regional trade agreements,News item,https://www.wto.org/english/news_e/news17_e/rta_03jul17_e.htm
Regional Trade Policy Course for Caribbean countries concludes in Barbados,News item,https://www.wto.org/english/news_e/news17_e/tech_23jun17_e.htm
Regional Trade Policy Course for Caribbean countries under way,News item,https://www.wto.org/english/news_e/news17_e/tech_12may17_e.htm
WTO members discuss trade facilitation provisions in RTAs,News item,https://www.wto.org/english/news_e/news17_e/rta_03apr17_e.htm
WTO members discuss three regional trade agreements,News item,https://www.wto.org/english/news_e/news16_e/rta_07nov16_e.htm
Book Launch: “Regional Trade Agreements and the Multilateral Trading System”,Opening remarks by DG Azevêdo,https://www.wto.org/english/news_e/spra_e/spra138_e.htm
New book examines provisions in RTAs and their impact on WTO rules and members,News item,https://www.wto.org/english/news_e/news16_e/publ_29sep16_e.htm
Chair reports ‘widespread support’ for holding talks on regional trade agreements,News item,https://www.wto.org/english/news_e/news16_e/rta_05oct16_e.htm
Report urges WTO members to resist protectionism and “get trade moving again”,News item,https://www.wto.org/english/news_e/news16_e/trdev_22jul16_e.htm
Several members back talks on impact of regional trade deals on global system,News item,https://www.wto.org/english/news_e/news16_e/rta_27jun16_e.htm
WTO members reach milestone on regional trade agreements,News item,https://www.wto.org/english/news_e/news16_e/rta_02jun16_e.htm
“Clear interest” in securing outcomes in rules negotiations for 2017 Ministerial,News item,https://www.wto.org/english/news_e/news16_e/rule_25may16_e.htm
DG Azevêdo: A healthy trading system requires progress and engagement at all levels,Speech,https://www.wto.org/english/news_e/spra_e/spra119_e.htm
Members renew attempts to deepen WTO scrutiny of regional trade agreements,News item,https://www.wto.org/english/news_e/news16_e/rta_08apr16_e.htm
WTO members secure “historic” Nairobi Package for Africa and the world,News item,https://www.wto.org/english/news_e/news15_e/mc10_19dec15_e.htm
"WTO members discuss two regional trade agreements, note pending committee work",News item,https://www.wto.org/english/news_e/news15_e/rta_16nov15_e.htm
"WTO members consider four regional trade agreements, note importance of prompt submissions",News item,https://www.wto.org/english/news_e/news15_e/rta_25sep15_e.htm
Azevêdo: “Our record in recent years shows that we can deliver”,Speech,https://www.wto.org/english/news_e/spra_e/spra81_e.htm
WTO considers EU’s trade agreements with Moldova and Georgia,News item,https://www.wto.org/english/news_e/news15_e/rta_23jun15_e.htm
Members conclude oral review of three regional trade agreements,News item,https://www.wto.org/english/news_e/news15_e/rta_30mar15_e.htm
Regional initiatives cannot substitute for the multilateral trading system—Azevêdo,Speech,https://www.wto.org/english/news_e/spra_e/spra50_e.htm
Regional trade agreements “cannot substitute” the multilateral trading system—Azevêdo,Speech,https://www.wto.org/english/news_e/spra_e/spra33_e.htm
Regional trade agreements “cannot substitute” the multilateral trading system—Azevêdo,Statement by Roberto Azevêdo,https://www.wto.org/audio/2014_09_25dgrarta.mp3
"The trend towards increased regionalism could be reversed, new WTO research suggests",News item,https://www.wto.org/english/news_e/news14_e/rese_23apr14_e.htm
"Members review six free trade agreements, EU enlargement to 28 member states",News item,https://www.wto.org/english/news_e/news14_e/rta_08apr14_e.htm
Advanced course on regional trade agreements begins,News item,https://www.wto.org/english/news_e/news13_e/rta_16sep13_e.htm
WTO launches new database on preferential trade arrangements,News item,https://www.wto.org/english/news_e/news12_e/rta_13mar12_e.htm
"Lamy: Package of negotiating documents underscores value of Doha progress
But DG says differences over industrial tariff cuts effectively block further progress and put at risk conclusion in 2011",Documents from the negotiating chairs,https://www.wto.org/english/tratop_e/dda_e/chair_texts11_e/chair_texts11_e.htm
Regional trade agreement negotiators urged to move towards “zone of accommodation”,News item,https://www.wto.org/english/news_e/news11_e/rta_17mar11_e.htm
Rules Group begins review of transparency mechanism for regional trade agreements,News item,https://www.wto.org/english/news_e/news11_e/rule_04feb11_e.htm
Rules Group launches review of transparency mechanism for regional trade agreements,News item,https://www.wto.org/english/news_e/news10_e/rule_13dec10_e.htm
Goods Chair says 10 new regional trade agreements notified to the WTO,News item,https://www.wto.org/english/news_e/news09_e/good_30oct09_e.htm
WTO launches new database on regional trade agreements,Press release,https://www.wto.org/english/news_e/pres09_e/pr548_e.htm
WTO Forum: Are RTAs stepping stones or obstacles to the trading system?,Watch the video and add your comments online.,https://www.wto.org/english/forums_e/debates_e/debate3_e.htm
Proliferation of regional trade agreements “breeding concern” — Lamy,Speech,https://www.wto.org/english/news_e/sppl_e/sppl67_e.htm
Proliferation of regional trade agreements “breeding concern” — Lamy,Programme with presentations,https://www.wto.org/english/tratop_e/region_e/conference_sept07_e.htm
"WTO, HEI to hold conference on regional trade accords",Press release,https://www.wto.org/english/news_e/pres07_e/pr489_e.htm
"WTO, HEI to hold conference on regional trade accords",Programme,https://www.wto.org/english/tratop_e/region_e/conference_sept07_e.htm
WTO considers RTAs under new transparency mechanism,News item,https://www.wto.org/english/news_e/news07_e/rta_may07_e.htm
Regional agreements: the ‘pepper’ in the multilateral ‘curry’ — Lamy,Speech,https://www.wto.org/english/news_e/sppl_e/sppl53_e.htm
General Council establishes transparency mechanism for regional trade agreements,News,https://www.wto.org/english/news_e/news06_e/rta_15dec06_e.htm
Lamy welcomes WTO agreement on regional trade agreements,News item,https://www.wto.org/english/news_e/news06_e/rta_july06_e.htm
