title,type,url
,Mike Moore's farewell: “Our greatest motivation is the people we serve”,https://www.wto.org/english/news_e/spmm_e/spmm89_e.htm
,Doha Agenda will define trade relations and development for this century,https://www.wto.org/english/news_e/spmm_e/spmm88_e.htm
,"Transition economy members can enjoy prosperity and peace, Moore tells ministers",https://www.wto.org/english/news_e/spmm_e/spmm87_e.htm
,WTO organizes first WTO ministerial trade conference for Central Asia and Caucasus,https://www.wto.org/english/news_e/spmm_e/spmm86_e.htm
,Doha Development Agenda: the role of Regional Development Banks,https://www.wto.org/english/news_e/spmm_e/spmm85_e.htm
,Moore stresses development role of trade at WTO symposium,https://www.wto.org/english/news_e/pres02_e/pr290_e.htm
,Russia membership talks entering decisive and final phase — Moore,https://www.wto.org/english/news_e/spmm_e/spmm84_e.htm
,Helping poorer members is key to successfully concluding negotiations — Moore,https://www.wto.org/english/news_e/spmm_e/spmm83_e.htm
,"WTO is working on an Arab Region Strategy, Director-General Moore tells Qatar meeting",https://www.wto.org/english/news_e/spmm_e/spmm82_e.htm
,Moore calls for increased trade liberalization to help finance development,https://www.wto.org/english/news_e/spmm_e/spmm81_e.htm
,Workers benefit from trade liberalization — Moore,https://www.wto.org/english/news_e/spmm_e/spmm80_e.htm
,"WTO governments pledge 30m Swiss francs to help developing
countries in new trade round",https://www.wto.org/english/news_e/spmm_e/spmm79_e.htm
,Technical assistance key to Doha Agenda success — Moore,https://www.wto.org/english/news_e/spmm_e/spmm78_e.htm
,Moore asks business to help build “a world without walls”,https://www.wto.org/english/news_e/spmm_e/spmm77_e.htm
,Moore cites “good start” to Doha Development Round,https://www.wto.org/english/news_e/spmm_e/spmm76_e.htm
,Moore underscores parliamentarians' role in new negotiations,https://www.wto.org/english/news_e/spmm_e/spmm75_e.htm
,WTO Secretariat reorganizes for Development Round,https://www.wto.org/english/news_e/spmm_e/spmm74_e.htm
,Doha success marks a turning-point for the world trading system — Moore,https://www.wto.org/english/news_e/spmm_e/spmm73_e.htm
,World economy needs a boost from Doha — Moore,https://www.wto.org/english/news_e/spmm_e/spmm72_e.htm
,Moore lauds opening of legal aid centre for developing WTO members,https://www.wto.org/english/news_e/spmm_e/spmm71_e.htm
,Moore urges African support for new Round,https://www.wto.org/english/news_e/spmm_e/spmm70_e.htm
,Moore opens 3rd Geneva Week for non-resident members,https://www.wto.org/english/news_e/spmm_e/spmm69_e.htm
,New Round can deal with barriers to African exports — Moore,https://www.wto.org/english/news_e/spmm_e/spmm68_e.htm
,Moore calls for “civilized discourse” with NGOs,https://www.wto.org/english/news_e/spmm_e/spmm67_e.htm
,Development argument for new Round “compelling” — Moore,https://www.wto.org/english/news_e/spmm_e/spmm66_e.htm
,WTO chief announces Arab region strategy ahead of Doha conference,https://www.wto.org/english/news_e/spmm_e/spmm65_e.htm
,Moore calls on parliamentarians to support new Round,https://www.wto.org/english/news_e/spmm_e/spmm64_e.htm
,New Round is surest way to prevent further LDC marginalization — Moore,https://www.wto.org/english/news_e/spmm_e/spmm63_e.htm
,WTO Secretariat organizes workshop on technical assistance in trade facilitation,https://www.wto.org/english/news_e/spmm_e/spmm62_e.htm
,workshop,https://www.wto.org/english/tratop_e/tradfa_e/tradfac_workshop_may01_e.htm
,Positive signs for Round launch in Doha — Moore,https://www.wto.org/english/news_e/spmm_e/spmm61_e.htm
,German Foundation for International Development,https://www.wto.org/english/news_e/spmm_e/spmm60_e.htm
,"German council on foreign relations, Berlin",https://www.wto.org/english/news_e/spmm_e/spmm59_e.htm
,Moore welcomes news of settlement of South Africa drug lawsuit,https://www.wto.org/english/news_e/spmm_e/spmm58_e.htm
,Greater involvement of parliamentarians in WTO work urged,https://www.wto.org/english/news_e/spmm_e/spmm57_e.htm
,Moore and Putin upbeat on Russia’s membership bid,https://www.wto.org/english/news_e/spmm_e/spmm56_e.htm
,Poor-country issues must be at heart of new Round — Moore,https://www.wto.org/english/news_e/spmm_e/spmm55_e.htm
,Moore sees “positive signs” for Round launch in Doha,https://www.wto.org/english/news_e/spmm_e/spmm54_e.htm
,“Agriculture's stake in WTO trade negotiations”,https://www.wto.org/english/news_e/spmm_e/spmm53_e.htm
,Australia's National Press Club (5 February 2001),https://www.wto.org/english/news_e/spmm_e/spmm52_e.htm
,Australia-Israel Chamber of Commerce (2 February 2001),https://www.wto.org/english/news_e/spmm_e/spmm51_e.htm
,Moore welcomes new market opening for LDCs,https://www.wto.org/english/news_e/spmm_e/spmm50_e.htm
,Moore underlines trade's development role,https://www.wto.org/english/news_e/spmm_e/spmm49_e.htm
,New round needed to counter threat of protectionism — Moore,https://www.wto.org/english/news_e/spmm_e/spmm48_e.htm
,Round will boost agriculture negotiations — Moore,https://www.wto.org/english/news_e/spmm_e/spmm47_e.htm
,Moore: 2000 a year of challenge and consolidation for the WTO,https://www.wto.org/english/news_e/spmm_e/spmm46_e.htm
,annual report,https://www.wto.org/english/news_e/news00_e/ov6_e.doc
,Regional initiatives cannot be a substitute to the WTO — Moore,https://www.wto.org/english/news_e/spmm_e/spmm45_e.htm
,Libreville 2000 — Meeting of African trade ministers,https://www.wto.org/english/news_e/spmm_e/spmm44_e.htm
,Africa's concerns should be on the new round's agenda — Moore,https://www.wto.org/english/news_e/spmm_e/spmm43_e.htm
,The WTO: New Issues; A New Round: When and How?,https://www.wto.org/english/news_e/spmm_e/spmm42_e.htm
,Transition economies and the WTO,https://www.wto.org/english/news_e/spmm_e/spmm41_e.htm
,Moore cites e-commerce potential for development,https://www.wto.org/english/news_e/spmm_e/spmm40_e.htm
,ITC Briefing Session,https://www.wto.org/english/news_e/news00_e/prog_ecom_e.htm
,“The Backlash Against Globalization?”,https://www.wto.org/english/news_e/spmm_e/spmm39_e.htm
,Moore calls for cooperation on trade-environment issues,https://www.wto.org/english/news_e/spmm_e/spmm38_e.htm
,Moore welcomes US Senate vote on China,https://www.wto.org/english/news_e/spmm_e/spmm37_e.htm
,Moore cites need for dialogue and cooperation in financial services,https://www.wto.org/english/news_e/spmm_e/spmm36_e.htm
,Reflections on the global trading system,https://www.wto.org/english/news_e/spmm_e/spmm35_e.htm
,Trade lifts people out of poverty,https://www.wto.org/english/news_e/spmm_e/spmm34_e.htm
,In Praise of the Future,https://www.wto.org/english/news_e/spmm_e/spmm33_e.htm
,"Trade, Poverty and The Human Face of Globalization",https://www.wto.org/english/news_e/spmm_e/spmm32_e.htm
,The National Foreign Trade Council's World Trade Dinner,https://www.wto.org/english/news_e/spmm_e/spmm31_e.htm
,,http://www.wto.org/wto/speeches/NY.htm
,The post-Seattle trade agenda,https://www.wto.org/english/news_e/spmm_e/spmm30_e.htm
,Globalisation and the Social Market Economy,https://www.wto.org/english/news_e/spmm_e/spmm29_e.htm
,WTO now in much better shape with new agreements--Moore,https://www.wto.org/english/news_e/spmm_e/spmm28_e.htm
,Moore urges trade package for poorest countries,https://www.wto.org/english/news_e/spmm_e/spmm27_e.htm
,After Seattle – The WTO and Developing Countries,https://www.wto.org/english/news_e/spmm_e/spmm26_e.htm
,Prospects for the Developing Countries in the Next Round,https://www.wto.org/english/news_e/spmm_e/spmm25_e.htm
,"The WTO is back on track - ""Back On Track for Trade and Development""",https://www.wto.org/english/news_e/spmm_e/spmm24_e.htm
,Indonesia must promote justice and human progress,https://www.wto.org/english/news_e/spmm_e/spmm23_e.htm
,"""Open societies do better""",https://www.wto.org/english/news_e/spmm_e/spmm22_e.htm
,"""Revisiting the multilateral trading system""",https://www.wto.org/english/news_e/spmm_e/spmm21_e.htm
,Director General Mike Moore has just returned to the Geneva Headquarters of the WTO after a series of meetings with Ministers and senior officials.,https://www.wto.org/english/news_e/spmm_e/spmm20_e.htm
,"""It is vital to maintain and consolidate what has already been achieved.""",https://www.wto.org/english/news_e/spmm_e/spmm19_e.htm
,Speech Notes to Legislators Assembly,https://www.wto.org/english/news_e/spmm_e/spmm18_e.htm
,"Statement by Mike Moore at President Bill Clinton's Lunch,",https://www.wto.org/english/news_e/spmm_e/spmm17_e.htm
,Seattle conference doomed to succeed,https://www.wto.org/english/news_e/spmm_e/spmm16_e.htm
,"New Zealand's Trade Minister, Lockwood Smith, Tapped for Key Ministerial Chairmanship",https://www.wto.org/english/news_e/spmm_e/spmm15_e.htm
,"National Conference on the Millennium Round, Rome",https://www.wto.org/english/news_e/spmm_e/spmm14_e.htm
,Seattle: What's at Stake?,https://www.wto.org/english/news_e/spmm_e/spmm13_e.htm
,"Address to the Ministerial Meeting of Least-Developed Countries, United Nations, New York",https://www.wto.org/english/news_e/spmm_e/spmm12_e.htm
,Development Committee of the World Bank,https://www.wto.org/english/news_e/spmm_e/spmm11_e.htm
,House Ways and Means Committee,https://www.wto.org/english/news_e/spmm_e/spmm10_e.htm
,Executive Session of the Senate Finance Committee,https://www.wto.org/english/news_e/spmm_e/spmm09_e.htm
,"""Challenges for the global trading system in the new millennium""",https://www.wto.org/english/news_e/spmm_e/spmm08_e.htm
,Africa and the multilateral trading system: challenges and opportunities,https://www.wto.org/english/news_e/spmm_e/spmm07_e.htm
,"""The future of international trade in services""",https://www.wto.org/english/news_e/spmm_e/spmm06_e.htm
,Conference on Developing Countries' Interests in a Millennium Round,https://www.wto.org/english/news_e/spmm_e/spmm05_e.htm
,Trade for development - the way ahead,https://www.wto.org/english/news_e/spmm_e/spmm04_e.htm
,Address Via Video-Conference - A challenge to APEC business,https://www.wto.org/english/news_e/spmm_e/spmm03_e.htm
,Launch of Report into: APEC 10 years & beyond,https://www.wto.org/english/news_e/spmm_e/spmm02_e.htm
,The WTO: The Challenge Ahead,https://www.wto.org/english/news_e/spmm_e/spmm01_e.htm
,Speeches given by Renato Ruggiero 1995–1999,https://www.wto.org/english/news_e/sprr_e/sprr_e.htm
